<?xml version="1.0" encoding="UTF-8"?>
<QueueReaderConfiguration xmlns:xsi="http://www.w3.org/2001/XMLSchema-instance" xsi:noNamespaceSchemaLocation="../../../../eds-messaging-core/src/main/resources/QueueReaderConfiguration.xsd">
    <Credentials>
        <Username>username</Username>
        <Password>password</Password>
    </Credentials>
    <Nodes>192.168.0.1:1000, 192.168.0.2:2000</Nodes>
    <Queue>Subscriber-Orgs1000-2000</Queue>
    <Pipeline>
        <PostToSubscriberWebService/>
    </Pipeline>
</QueueReaderConfiguration>