<?xml version="1.0" encoding="UTF-8"?>
<QueueReaderConfiguration xmlns:xsi="http://www.w3.org/2001/XMLSchema-instance" xsi:noNamespaceSchemaLocation="QueueReaderConfiguration.xsd">
    <Credentials>
        <Username>username</Username>
        <Password>password</Password>
    </Credentials>
    <Nodes>192.168.0.1:1000, 192.168.0.2:2000</Nodes>
    <Exchange>Response</Exchange>
    <Queue>Response-Orgs1000-2000</Queue>
    <RoutingKeys>Org1,Org2,Org3</RoutingKeys>
    <MessagePipelineClass>org.endeavourhealth.queuereader.pipeline.ResponsePipeline</MessagePipelineClass>
</QueueReaderConfiguration>